{
  "id": "ev-benchmark-example-001",
  "artifact_type": "benchmark_result",
  "category": "benchmark",
  "evidence_status": "example_placeholder",
  "summary": "Template for a replayable benchmark result comparing GoalOS workflow to a named baseline.",
  "created_at": "2026-06-26T18:05:13.007030+00:00",
  "confidentiality": "public",
  "public_claim_permission": "not_allowed",
  "metrics": {
    "baseline_method": null,
    "completion_rate": null,
    "cost_per_accepted_result": null,
    "validation_pass_rate": null
  },
  "source_provenance": {
    "source_type": "template",
    "source_status": "not_real_benchmark_evidence"
  }
}
